{
  "$schema": "https://schemas.aoa.local/models/model-fit-projection.schema.json",
  "authority": {
    "acceptance_authority": false,
    "activation_authority": false,
    "informational_only": true,
    "proof_authority": false
  },
  "consumers": [
    "aoa-agents",
    "aoa-sdk",
    "abyss-stack"
  ],
  "effect_family": "read",
  "freshness": {
    "review_by": "2026-08-22T00:00:00Z",
    "status": "current"
  },
  "generated_at": "2026-08-15T10:45:00Z",
  "generated_from_claim_refs": [
    "source/model-claims/luna-bounded-eval-role-fit-max-structured-owner-duty-hypothesis-v1.json"
  ],
  "kind": "ModelFitProjection",
  "model_fit_projection_id": "model-fit-projection:openai-gpt-5.6-luna-codex-0.147.0-chatgpt-max-structured-owner-duty-workspace-write",
  "must_not_claim": [
    "routing or activation authority",
    "proof or owner acceptance",
    "task completion or target-owner acceptance",
    "internal geometry or training lineage from behavior alone"
  ],
  "posture": "declared",
  "schema_version": "aoa_model_fit_projection_v1",
  "study_refs": [],
  "subject_realization_ref": "source/model-realizations/openai-gpt-5.6-luna-codex-0.147.0-chatgpt-max-structured-owner-duty-workspace-write.json",
  "task_fit": [
    {
      "claim_posture": "hypothesis",
      "conditions": [
        "aoa-agents supplies the role mandate, holder, return owner, authority ceiling and stop-line before model binding",
        "aoa-evals supplies the exact named procedure, inputs, criteria, blind spots and output shape",
        "the actor inspects real immutable work evidence, including failed or blocked attempts, rather than grading a sterile success fixture",
        "the actor keeps initiative bounded to discovering and reporting evidence gaps or owner-correct next routes, without inventing a new procedure or acceptance meaning",
        "the actor keeps executed paths inside the declared scope and discloses narrowing, widening, reshaping, or authority blockage",
        "handoff returns exact artifacts, residuals and owner references for independent review; checkpoint resume preserves the same task/thread anchor or safe-stops honestly",
        "the exact Codex 0.147.0 max realization is live-catalog compatible and the bound runtime is artifact-admitted before launch",
        "usage is counted from runtime receipts and never becomes a caller-authored execution budget"
      ],
      "escalation_required": true,
      "exclusions": [
        "inventing an eval, proof invariant, rubric, metric, verdict scale, owner acceptance or model-fit meaning",
        "issuing final proof, owner acceptance, release, landing, activation, merge, publication, or runtime verdicts",
        "autonomous commit, push, merge, external effect, or authority widening beyond the mandate",
        "treating a draft aoa-evals bundle, MCP response, green validation, receipt, or generated projection as central proof or acceptance",
        "claiming general initiative, child-output quality, live runtime readiness, remote transport reliability, or cross-task reliability",
        "transferring the role identity of evaluator, runtime owner, stats owner, memo owner, or acceptance holder from the model name",
        "inferring closed-model internal geometry or training lineage from behavior"
      ],
      "task_family": "eval"
    }
  ]
}
