{
  "$schema": "https://schemas.aoa.local/models/model-fit-projection.schema.json",
  "authority": {
    "acceptance_authority": false,
    "activation_authority": false,
    "informational_only": true,
    "proof_authority": false
  },
  "consumers": [
    "aoa-agents",
    "aoa-sdk",
    "abyss-stack"
  ],
  "effect_family": "read",
  "freshness": {
    "review_by": "2026-08-19T00:00:00Z",
    "status": "current"
  },
  "generated_at": "2026-08-14T00:00:00Z",
  "generated_from_claim_refs": [
    "source/model-claims/luna-bounded-eval-review-role-fit-hypothesis-v1.json"
  ],
  "kind": "ModelFitProjection",
  "model_fit_projection_id": "model-fit-projection:openai-gpt-5.6-luna-codex-0.147.0-chatgpt-xhigh-eval-reader-readonly",
  "must_not_claim": [
    "routing or activation authority",
    "proof or owner acceptance",
    "task completion or target-owner acceptance",
    "internal geometry or training lineage from behavior alone"
  ],
  "posture": "declared",
  "schema_version": "aoa_model_fit_projection_v1",
  "study_refs": [],
  "subject_realization_ref": "source/model-realizations/openai-gpt-5.6-luna-codex-0.147.0-chatgpt-xhigh-eval-reader-readonly.json",
  "task_fit": [
    {
      "claim_posture": "hypothesis",
      "conditions": [
        "the writer result, model report, selected output, task contract and target owner are exact immutable inputs",
        "the current aoa-evals source and the review done state are inspectable",
        "the reviewer has a separate identity, thread and read-only environment",
        "the reviewer may confirm or return for repair but cannot mutate or self-accept the writer result",
        "owner acceptance, eval design, eval execution and model-fit admission remain outside the mandate",
        "the exact Codex 0.147.0 realization and admitted abyss-stack read-only profile are bound before launch",
        "usage is counted from runtime receipts and is not constrained by a caller-authored execution budget"
      ],
      "escalation_required": true,
      "exclusions": [
        "repairing writer source, report or output",
        "inventing a rubric, eval, metric, proof verdict or owner meaning",
        "issuing aoa-evals owner acceptance or a model-fit conclusion",
        "autonomous commit, push, merge, publication, network access or external effects",
        "treating the writer's successful transport as correctness evidence",
        "inferring closed-model internal geometry or training lineage from behavior"
      ],
      "task_family": "eval-review"
    }
  ]
}
