{
  "$schema": "https://schemas.aoa.local/models/model-fit-projection.schema.json",
  "authority": {
    "acceptance_authority": false,
    "activation_authority": false,
    "informational_only": true,
    "proof_authority": false
  },
  "consumers": [
    "aoa-agents",
    "aoa-sdk",
    "abyss-stack"
  ],
  "effect_family": "read",
  "freshness": {
    "review_by": null,
    "status": "current"
  },
  "generated_at": "2026-08-24T06:23:38Z",
  "generated_from_claim_refs": [
    "source/model-claims/luna-codex-0.149.1-currentness-nontransfer-hypothesis-v1.json"
  ],
  "kind": "ModelFitProjection",
  "model_fit_projection_id": "model-fit-projection:openai-gpt-5.6-luna-codex-0.149.1-chatgpt-max-structured-owner-duty-workspace-write",
  "must_not_claim": [
    "routing or activation authority",
    "proof or owner acceptance",
    "task completion or target-owner acceptance",
    "internal geometry or training lineage from behavior alone"
  ],
  "posture": "declared",
  "schema_version": "aoa_model_fit_projection_v1",
  "study_refs": [],
  "subject_realization_ref": "source/model-realizations/openai-gpt-5.6-luna-codex-0.149.1-chatgpt-max-structured-owner-duty-workspace-write.json",
  "task_fit": [
    {
      "claim_posture": "hypothesis",
      "conditions": [
        "the exact runtime_subject source and digest match the runtime binding, and the 0.149.1 package members plus required companions are independently artifact-admitted before launch",
        "the selected realization, runtime profile, model slug, reasoning effort, permissions and tool profile match exactly",
        "the live Codex catalog remains compatible with the same runtime subject at launch time",
        "a new bounded real-work canary returns runtime receipts and separately reviewed evidence before any fit promotion"
      ],
      "escalation_required": true,
      "exclusions": [
        "transferring any Codex 0.148.0 behavioral fit, task outcome, reliability, handoff, wake, resume, or acceptance claim",
        "transferring the 0.148.0 runtime profile, package-member identity, or currentness conclusion to the 0.149.1 subject",
        "using package metadata or artifact admission as activation, routing, process health, proof, or owner acceptance",
        "claiming general Luna competence, autonomy, initiative, evaluator authority, or task completion",
        "inferring closed-model internals or training lineage from runtime availability or behavior"
      ],
      "task_family": "structured-owner-duty-currentness"
    }
  ]
}
