{
  "$schema": "https://schemas.aoa.local/models/model-fit-projection.schema.json",
  "authority": {
    "acceptance_authority": false,
    "activation_authority": false,
    "informational_only": true,
    "proof_authority": false
  },
  "consumers": [
    "aoa-agents",
    "aoa-sdk",
    "abyss-stack"
  ],
  "effect_family": "read",
  "freshness": {
    "review_by": "2026-08-22T00:00:00Z",
    "status": "current"
  },
  "generated_at": "2026-08-11T02:09:22Z",
  "generated_from_claim_refs": [
    "source/model-claims/luna-bounded-eval-role-fit-hypothesis-v1.json",
    "source/model-claims/luna-bounded-memo-role-fit-hypothesis-v1.json",
    "source/model-claims/luna-bounded-stats-role-fit-hypothesis-v1.json"
  ],
  "kind": "ModelFitProjection",
  "model_fit_projection_id": "model-fit-projection:openai-gpt-5.6-luna-codex-0.147.0-chatgpt-xhigh-structured-owner-duty-workspace-write",
  "must_not_claim": [
    "routing or activation authority",
    "proof or owner acceptance",
    "task completion or target-owner acceptance",
    "internal geometry or training lineage from behavior alone"
  ],
  "posture": "declared",
  "schema_version": "aoa_model_fit_projection_v1",
  "study_refs": [],
  "subject_realization_ref": "source/model-realizations/openai-gpt-5.6-luna-codex-0.147.0-chatgpt-xhigh-structured-owner-duty-workspace-write.json",
  "task_fit": [
    {
      "claim_posture": "hypothesis",
      "conditions": [
        "the eval owner, exact procedure, inputs, criteria and named outputs are explicit",
        "the actor applies rather than invents proof doctrine or acceptance criteria",
        "the work runs in an isolated projection with effects bounded by the mandate",
        "the result returns to the eval owner for independent review and verdict meaning",
        "the exact Codex 0.147.0 realization passes the live catalog check",
        "the bound abyss-stack external actor runtime is artifact-admitted before launch",
        "usage is counted from runtime receipts and never becomes a caller-authored execution budget"
      ],
      "escalation_required": true,
      "exclusions": [
        "inventing an eval, proof invariant, rubric or verdict scale",
        "issuing final proof, owner acceptance, release or landing verdicts",
        "widening the target beyond the named inputs and procedure",
        "autonomous commit, push, merge, publication or undelegated external effect",
        "treating schema-valid completion or green tests as role fit",
        "inferring closed-model internal geometry or training lineage from behavior"
      ],
      "task_family": "eval"
    },
    {
      "claim_posture": "hypothesis",
      "conditions": [
        "the memo owner, reviewed evidence inputs, lifecycle target and named candidate output are explicit",
        "the actor preserves provenance and prepares rather than confirms durable memory",
        "the work runs in an isolated projection with effects bounded by the mandate",
        "the result returns to the memo owner for admission, quarantine or no-write review",
        "the exact Codex 0.147.0 realization passes the live catalog check",
        "the bound abyss-stack external actor runtime is artifact-admitted before launch",
        "usage is counted from runtime receipts and never becomes a caller-authored execution budget"
      ],
      "escalation_required": true,
      "exclusions": [
        "automatic promotion into durable memory or owner truth",
        "inventing provenance, review state, lifecycle or source authority",
        "copying private raw evidence into a public or stronger-owner surface",
        "autonomous commit, push, merge, publication or undelegated external effect",
        "treating a polished narrative as reviewed memory",
        "inferring closed-model internal geometry or training lineage from behavior"
      ],
      "task_family": "memo"
    },
    {
      "claim_posture": "hypothesis",
      "conditions": [
        "the stats owner, source receipts, compatibility contract, derivation and named outputs are explicit",
        "the actor derives declared measurements rather than inventing metrics or proof meaning",
        "the work runs in an isolated projection with effects bounded by the mandate",
        "the result returns to the stats owner for compatibility and source-coverage review",
        "the exact Codex 0.147.0 realization passes the live catalog check",
        "the bound abyss-stack external actor runtime is artifact-admitted before launch",
        "usage is counted from runtime receipts and never becomes a caller-authored execution budget"
      ],
      "escalation_required": true,
      "exclusions": [
        "inventing an owner metric, measurement ABI, threshold or acceptance rule",
        "issuing eval verdicts, model-fit conclusions or owner acceptance",
        "silently repairing missing or incompatible source receipts",
        "autonomous commit, push, merge, publication or undelegated external effect",
        "treating a generated summary as source truth",
        "inferring closed-model internal geometry or training lineage from behavior"
      ],
      "task_family": "stats"
    }
  ]
}
